"Enrichment FDR","nGenes","Pathway Genes","Fold Enrichment","Pathway","URL","Genes"
6.37311921737304e-16,10,41,118.297872340426,"One-carbon metabolic process "," http://amigo.geneontology.org/amigo/term/GO:0006730"," CA12  CA9  CA14  CA6  CA1  CA3  CA4  CA7  CA5B  CA5A"
6.37311921737304e-16,10,42,115.48125633232,"Bicarbonate transport "," http://amigo.geneontology.org/amigo/term/GO:0015701"," CA12  CA9  CA14  CA6  CA1  CA3  CA4  CA7  CA5B  CA5A"
1.45530421928034e-08,8,98,39.5935735996526,"Regulation of cyclin-dependent protein serine/threonine kinase activity "," http://amigo.geneontology.org/amigo/term/GO:0000079"," CCND1  PKD2  CCNA1  CCNH  CCNB3  CCNB2  CCNE2  CDK5R1"
1.51175758108455e-08,8,102,38.0408844388819,"Regulation of cyclin-dependent protein kinase activity "," http://amigo.geneontology.org/amigo/term/GO:1904029"," CCND1  PKD2  CCNA1  CCNH  CCNB3  CCNB2  CCNE2  CDK5R1"
2.06297019360272e-06,10,390,12.4364429896345,"Organic anion transport "," http://amigo.geneontology.org/amigo/term/GO:0015711"," CA12  CA9  CA14  CA6  CA1  CA3  CA4  CA7  CA5B  CA5A"
7.23240688420392e-06,17,1720,4.79381494309748,"Ion transport "," http://amigo.geneontology.org/amigo/term/GO:0006811"," CA12  CA9  CA14  PKD2  CA6  CA1  CA3  CA4  CA7  CA5B  KCND3  CA5A  KCNE1  SCN5A  HTT  KCNQ1  CACNA1C"
7.85252130815582e-06,9,344,12.6895101434933,"Regulation of protein serine/threonine kinase activity "," http://amigo.geneontology.org/amigo/term/GO:0071900"," CCND1  PKD2  CCNA1  CCNH  CCNB3  CCNB2  CCNE2  CDK5R1  HTT"
4.77064961891267e-05,10,573,8.46459470498682,"Anion transport "," http://amigo.geneontology.org/amigo/term/GO:0006820"," CA12  CA9  CA14  CA6  CA1  CA3  CA4  CA7  CA5B  CA5A"
7.14949128317656e-05,15,1595,4.56132862002268,"Regulation of phosphate metabolic process "," http://amigo.geneontology.org/amigo/term/GO:0019220"," THPO  VRK3  CCND1  PKD2  PIN1  CCNA1  CCNH  PARP1  CCNB3  PDK1  CCNB2  CCNE2  CDK5R1  HTT  PRKDC"
7.14949128317656e-05,15,1595,4.56132862002268,"Regulation of phosphorus metabolic process "," http://amigo.geneontology.org/amigo/term/GO:0051174"," THPO  VRK3  CCND1  PKD2  PIN1  CCNA1  CCNH  PARP1  CCNB3  PDK1  CCNB2  CCNE2  CDK5R1  HTT  PRKDC"
0.000113925296469904,15,1678,4.33570867040296,"Protein phosphorylation "," http://amigo.geneontology.org/amigo/term/GO:0006468"," PIK3C3  THPO  VRK3  CCND1  PKD2  PIN1  CCNA1  CCNH  CCNB3  PDK1  CCNB2  CCNE2  CDK5R1  HTT  PRKDC"
0.000113925296469904,4,34,57.0613266583229,"Ventricular cardiac muscle cell action potential "," http://amigo.geneontology.org/amigo/term/GO:0086005"," KCND3  KCNE1  SCN5A  CACNA1C"
0.000213527997679493,4,41,47.3191489361702,"Regulation of heart rate by cardiac conduction "," http://amigo.geneontology.org/amigo/term/GO:0086091"," KCND3  KCNE1  SCN5A  CACNA1C"
0.000394552574370977,12,1167,4.98736531203851,"Regulation of protein phosphorylation "," http://amigo.geneontology.org/amigo/term/GO:0001932"," THPO  CCND1  PKD2  PIN1  CCNA1  CCNH  CCNB3  CCNB2  CCNE2  CDK5R1  HTT  PRKDC"
0.000486571798889813,4,52,37.3093289689034,"Cardiac muscle cell action potential involved in contraction "," http://amigo.geneontology.org/amigo/term/GO:0086002"," KCND3  KCNE1  SCN5A  CACNA1C"
0.000497026561319323,12,1209,4.81410696372948,"Regulation of cell cycle "," http://amigo.geneontology.org/amigo/term/GO:0051726"," PIK3C3  CCND1  PKD2  PIN1  CCNA1  CCNH  CCNB3  CCNB2  HPGD  CCNE2  CDK5R1  TUBB"
0.00114811581838842,9,697,6.26282853566959,"Regulation of protein kinase activity "," http://amigo.geneontology.org/amigo/term/GO:0045859"," CCND1  PKD2  CCNA1  CCNH  CCNB3  CCNB2  CCNE2  CDK5R1  HTT"
0.00133304673110127,12,1355,4.29539137944571,"Regulation of phosphorylation "," http://amigo.geneontology.org/amigo/term/GO:0042325"," THPO  CCND1  PKD2  PIN1  CCNA1  CCNH  CCNB3  CCNB2  CCNE2  CDK5R1  HTT  PRKDC"
0.00133304673110127,4,70,27.7155015197568,"Cardiac muscle cell contraction "," http://amigo.geneontology.org/amigo/term/GO:0086003"," KCND3  KCNE1  SCN5A  CACNA1C"
0.00149498411179767,13,1644,3.83532639643837,"Regulation of protein modification process "," http://amigo.geneontology.org/amigo/term/GO:0031399"," THPO  VRK3  CCND1  PKD2  PIN1  CCNA1  CCNH  CCNB3  CCNB2  CCNE2  CDK5R1  HTT  PRKDC"
0.00149498411179767,10,948,5.11625819193824,"Regulation of transferase activity "," http://amigo.geneontology.org/amigo/term/GO:0051338"," CCND1  PKD2  PIN1  CCNA1  CCNH  CCNB3  CCNB2  CCNE2  CDK5R1  HTT"
0.00149498411179767,4,74,26.2173663024727,"Cardiac muscle cell action potential "," http://amigo.geneontology.org/amigo/term/GO:0086001"," KCND3  KCNE1  SCN5A  CACNA1C"
0.00149498411179767,3,25,58.2025531914894,"Ventricular cardiac muscle cell membrane repolarization "," http://amigo.geneontology.org/amigo/term/GO:0099625"," KCND3  KCNE1  SCN5A"
0.00182054332786243,2,4,242.510638297872,"Positive regulation of inositol 1,4,5-trisphosphate-sensitive calcium-release channel activity "," http://amigo.geneontology.org/amigo/term/GO:0031587"," PKD2  HTT"
0.00182054332786243,2,4,242.510638297872,"Membrane depolarization during atrial cardiac muscle cell action potential "," http://amigo.geneontology.org/amigo/term/GO:0098912"," SCN5A  CACNA1C"
0.00210961452460638,8,606,6.40292114317815,"Regulation of system process "," http://amigo.geneontology.org/amigo/term/GO:0044057"," GLS  PIN1  PARP1  THRB  KCND3  KCNE1  SCN5A  CACNA1C"
0.00217126226310377,3,30,48.5021276595745,"Positive regulation of cyclin-dependent protein serine/threonine kinase activity "," http://amigo.geneontology.org/amigo/term/GO:0045737"," CCND1  PKD2  CDK5R1"
0.00217529090939387,8,615,6.30921985815603,"Mitotic cell cycle phase transition "," http://amigo.geneontology.org/amigo/term/GO:0044772"," CCND1  PKD2  CCNA1  CCNH  CCNB3  CCNB2  CCNE2  TUBB"
0.00223653306086642,10,1021,4.7504532477546,"Mitotic cell cycle process "," http://amigo.geneontology.org/amigo/term/GO:1903047"," CCND1  PKD2  PIN1  CCNA1  CCNH  CCNB3  CCNB2  CCNE2  HTT  TUBB"
0.00243649021803725,9,824,5.29756248708944,"Regulation of kinase activity "," http://amigo.geneontology.org/amigo/term/GO:0043549"," CCND1  PKD2  CCNA1  CCNH  CCNB3  CCNB2  CCNE2  CDK5R1  HTT"
0.00244374714728215,2,5,194.008510638298,"Regulation of inositol 1,4,5-trisphosphate-sensitive calcium-release channel activity "," http://amigo.geneontology.org/amigo/term/GO:0031585"," PKD2  HTT"
0.00260324590680971,9,839,5.20285040448355,"Ion homeostasis "," http://amigo.geneontology.org/amigo/term/GO:0050801"," CA12  GLP1R  GLS  PKD2  PARP1  CA7  SCN5A  HTT  CACNA1C"
0.00260324590680971,3,34,42.7959949937422,"Positive regulation of cyclin-dependent protein kinase activity "," http://amigo.geneontology.org/amigo/term/GO:1904031"," CCND1  PKD2  CDK5R1"
0.00291863685132313,8,659,5.88796693894682,"Cell division "," http://amigo.geneontology.org/amigo/term/GO:0051301"," PIK3C3  CCND1  PIN1  CCNA1  CCNB3  CCNB2  CCNE2  TUBB"
0.00292019411582928,3,36,40.4184397163121,"Cardiac muscle cell membrane repolarization "," http://amigo.geneontology.org/amigo/term/GO:0099622"," KCND3  KCNE1  SCN5A"
0.00306596640193983,4,103,18.8357777318736,"Regulation of heart rate "," http://amigo.geneontology.org/amigo/term/GO:0002027"," KCND3  KCNE1  SCN5A  CACNA1C"
0.00306715522809123,2,6,161.673758865248,"Membrane depolarization during AV node cell action potential "," http://amigo.geneontology.org/amigo/term/GO:0086045"," SCN5A  CACNA1C"
0.00432659409493491,13,1910,3.30119193494486,"Regulation of transport "," http://amigo.geneontology.org/amigo/term/GO:0051049"," PIK3C3  GLP1R  PKD2  RAB9A  CA7  KCND3  CDK5R1  KCNE1  SCN5A  HTT  ATXN2  KCNQ1  CACNA1C"
0.00455681359490382,10,1166,4.15970220064961,"Mitotic cell cycle "," http://amigo.geneontology.org/amigo/term/GO:0000278"," CCND1  PKD2  PIN1  CCNA1  CCNH  CCNB3  CCNB2  CCNE2  HTT  TUBB"
0.00455681359490382,9,937,4.65868888939349,"Regulation of protein localization "," http://amigo.geneontology.org/amigo/term/GO:0032880"," PIK3C3  GLP1R  RAB9A  PIN1  PARP1  CCNE2  CDK5R1  KCNE1  CACNA1C"
0.00455681359490382,7,533,6.36988543371522,"Regulation of ion transmembrane transport "," http://amigo.geneontology.org/amigo/term/GO:0034765"," PKD2  KCND3  KCNE1  SCN5A  HTT  KCNQ1  CACNA1C"
0.00455681359490382,8,725,5.35195891415994,"Cell cycle phase transition "," http://amigo.geneontology.org/amigo/term/GO:0044770"," CCND1  PKD2  CCNA1  CCNH  CCNB3  CCNB2  CCNE2  TUBB"
0.00455681359490382,4,120,16.1673758865248,"Actin-mediated cell contraction "," http://amigo.geneontology.org/amigo/term/GO:0070252"," KCND3  KCNE1  SCN5A  CACNA1C"
0.00455681359490382,3,45,32.3347517730496,"Membrane repolarization "," http://amigo.geneontology.org/amigo/term/GO:0086009"," KCND3  KCNE1  SCN5A"
0.0046951393279718,2,8,121.255319148936,"Protein poly-ADP-ribosylation "," http://amigo.geneontology.org/amigo/term/GO:0070212"," TNKS2  PARP1"
0.00517113198170206,5,239,10.1468886317101,"Regulation of heart contraction "," http://amigo.geneontology.org/amigo/term/GO:0008016"," THRB  KCND3  KCNE1  SCN5A  CACNA1C"
0.00549860593122301,13,1997,3.15737435941146,"Cell cycle "," http://amigo.geneontology.org/amigo/term/GO:0007049"," PIK3C3  CCND1  PKD2  PIN1  CCNA1  CCNH  CCNB3  CCNB2  HPGD  CCNE2  CDK5R1  HTT  TUBB"
0.00572035242984018,8,763,5.08541312289116,"Regulation of ion transport "," http://amigo.geneontology.org/amigo/term/GO:0043269"," PKD2  CA7  KCND3  KCNE1  SCN5A  HTT  KCNQ1  CACNA1C"
0.00576885118060999,5,248,9.7786547700755,"G1/S transition of mitotic cell cycle "," http://amigo.geneontology.org/amigo/term/GO:0000082"," CCND1  PKD2  CCNA1  CCNH  CCNE2"
0.00611889199477142,4,134,14.4782470625595,"Action potential "," http://amigo.geneontology.org/amigo/term/GO:0001508"," KCND3  KCNE1  SCN5A  CACNA1C"
0.00635028146149883,4,136,14.2653316645807,"Cardiac muscle contraction "," http://amigo.geneontology.org/amigo/term/GO:0060048"," KCND3  KCNE1  SCN5A  CACNA1C"
0.00637518826971551,11,1496,3.56633291614518,"Cell cycle process "," http://amigo.geneontology.org/amigo/term/GO:0022402"," PIK3C3  CCND1  PKD2  PIN1  CCNA1  CCNH  CCNB3  CCNB2  CCNE2  HTT  TUBB"
0.00682579711606867,4,142,13.6625711717111,"Response to ethanol "," http://amigo.geneontology.org/amigo/term/GO:0045471"," ARSA  CCND1  HPGD  CA3"
0.00682579711606867,10,1264,3.83719364395368,"Chemical homeostasis "," http://amigo.geneontology.org/amigo/term/GO:0048878"," CA12  GLP1R  GLS  PKD2  EPHX2  PARP1  CA7  SCN5A  HTT  CACNA1C"
0.00682579711606867,4,141,13.7594688395956,"Cardiac conduction "," http://amigo.geneontology.org/amigo/term/GO:0061337"," KCND3  KCNE1  SCN5A  CACNA1C"
0.00682579711606867,5,263,9.22093681740959,"Response to alcohol "," http://amigo.geneontology.org/amigo/term/GO:0097305"," ARSA  CCND1  PARP1  HPGD  CA3"
0.00712727225930177,2,11,88.1856866537718,"AV node cell action potential "," http://amigo.geneontology.org/amigo/term/GO:0086016"," SCN5A  CACNA1C"
0.00712727225930177,2,11,88.1856866537718,"AV node cell to bundle of His cell signaling "," http://amigo.geneontology.org/amigo/term/GO:0086027"," SCN5A  CACNA1C"
0.0076968843379362,4,151,12.8482457376356,"Actin filament-based movement "," http://amigo.geneontology.org/amigo/term/GO:0030048"," KCND3  KCNE1  SCN5A  CACNA1C"
0.0076968843379362,7,622,5.45843880413218,"Regulation of transmembrane transport "," http://amigo.geneontology.org/amigo/term/GO:0034762"," PKD2  KCND3  KCNE1  SCN5A  HTT  KCNQ1  CACNA1C"
0.0076968843379362,5,278,8.72340425531915,"Cell cycle G1/S phase transition "," http://amigo.geneontology.org/amigo/term/GO:0044843"," CCND1  PKD2  CCNA1  CCNH  CCNE2"
0.0076968843379362,5,275,8.81856866537718,"Heart contraction "," http://amigo.geneontology.org/amigo/term/GO:0060047"," THRB  KCND3  KCNE1  SCN5A  CACNA1C"
0.0076968843379362,12,1832,3.17699526154418,"Response to oxygen-containing compound "," http://amigo.geneontology.org/amigo/term/GO:1901700"," PIK3C3  ARSA  CA9  CCND1  GLP1R  PKD2  PARP1  HPGD  CA3  CDK5R1  KCNE1  PRKDC"
0.00774071946352213,2,12,80.8368794326241,"Protein auto-ADP-ribosylation "," http://amigo.geneontology.org/amigo/term/GO:0070213"," TNKS2  PARP1"
0.00827941131836623,5,285,8.50914520343412,"Heart process "," http://amigo.geneontology.org/amigo/term/GO:0003015"," THRB  KCND3  KCNE1  SCN5A  CACNA1C"
0.00837587184705919,6,448,6.49582066869301,"Muscle system process "," http://amigo.geneontology.org/amigo/term/GO:0003012"," PIN1  PARP1  KCND3  KCNE1  SCN5A  CACNA1C"
0.00883897354112469,5,291,8.33369891057981,"Regulation of blood circulation "," http://amigo.geneontology.org/amigo/term/GO:1903522"," THRB  KCND3  KCNE1  SCN5A  CACNA1C"
0.00959528911153375,5,300,8.08368794326241,"G2/M transition of mitotic cell cycle "," http://amigo.geneontology.org/amigo/term/GO:0000086"," CCND1  CCNH  CCNB3  CCNB2  TUBB"
0.00959528911153375,8,872,4.44973648252977,"Regulation of cellular localization "," http://amigo.geneontology.org/amigo/term/GO:0060341"," PKD2  PIN1  PARP1  CCNE2  CDK5R1  KCNE1  HTT  CACNA1C"
0.00959528911153375,2,14,69.2887537993921,"AV node cell to bundle of His cell communication "," http://amigo.geneontology.org/amigo/term/GO:0086067"," SCN5A  CACNA1C"
0.00959528911153375,2,14,69.2887537993921,"Membrane repolarization during ventricular cardiac muscle cell action potential "," http://amigo.geneontology.org/amigo/term/GO:0098915"," KCND3  KCNE1"
0.00963951183965072,12,1911,3.04565950766559,"Homeostatic process "," http://amigo.geneontology.org/amigo/term/GO:0042592"," CA12  GLP1R  GLS  PKD2  EPHX2  PARP1  CCNB2  CA7  SCN5A  HTT  PRKDC  CACNA1C"
0.0109938025017136,5,311,7.79776972018882,"Cell cycle G2/M phase transition "," http://amigo.geneontology.org/amigo/term/GO:0044839"," CCND1  CCNH  CCNB3  CCNB2  TUBB"
0.0121847349100236,4,178,10.8993545302415,"Striated muscle contraction "," http://amigo.geneontology.org/amigo/term/GO:0006941"," KCND3  KCNE1  SCN5A  CACNA1C"
0.0125388025762642,4,180,10.7782505910165,"Telomere maintenance "," http://amigo.geneontology.org/amigo/term/GO:0000723"," TNKS2  PARP1  CCNE2  PRKDC"
0.0149923281638504,2,18,53.8912529550827,"Potassium ion export across plasma membrane "," http://amigo.geneontology.org/amigo/term/GO:0097623"," KCND3  KCNE1"
0.0155096766751052,4,194,10.0004386926958,"Telomere organization "," http://amigo.geneontology.org/amigo/term/GO:0032200"," TNKS2  PARP1  CCNE2  PRKDC"
0.0155096766751052,3,83,17.5308895155088,"Regulation of muscle adaptation "," http://amigo.geneontology.org/amigo/term/GO:0043502"," PIN1  PARP1  SCN5A"
0.0155096766751052,3,83,17.5308895155088,"Regulation of release of sequestered calcium ion into cytosol "," http://amigo.geneontology.org/amigo/term/GO:0051279"," PKD2  HTT  CACNA1C"
0.0155096766751052,2,19,51.0548712206047,"Atrial cardiac muscle cell action potential "," http://amigo.geneontology.org/amigo/term/GO:0086014"," SCN5A  CACNA1C"
0.0155096766751052,2,19,51.0548712206047,"Atrial cardiac muscle cell to AV node cell signaling "," http://amigo.geneontology.org/amigo/term/GO:0086026"," SCN5A  CACNA1C"
0.0155096766751052,2,19,51.0548712206047,"Atrial cardiac muscle cell to AV node cell communication "," http://amigo.geneontology.org/amigo/term/GO:0086066"," SCN5A  CACNA1C"
0.016780854082994,4,200,9.70042553191489,"Multicellular organismal signaling "," http://amigo.geneontology.org/amigo/term/GO:0035637"," KCND3  KCNE1  SCN5A  CACNA1C"
0.016780854082994,3,87,16.7248716067498,"Membrane depolarization "," http://amigo.geneontology.org/amigo/term/GO:0051899"," PARP1  SCN5A  CACNA1C"
0.0181134029330397,6,545,5.33968377903572,"Blood circulation "," http://amigo.geneontology.org/amigo/term/GO:0008015"," GLP1R  THRB  KCND3  KCNE1  SCN5A  CACNA1C"
0.0181134029330397,2,21,46.1925025329281,"Regulation of ventricular cardiac muscle cell membrane repolarization "," http://amigo.geneontology.org/amigo/term/GO:0060307"," KCNE1  SCN5A"
0.0196698661788828,2,22,44.0928433268859,"Membrane depolarization during cardiac muscle cell action potential "," http://amigo.geneontology.org/amigo/term/GO:0086012"," SCN5A  CACNA1C"
0.021270420545248,2,23,42.1757631822387,"Membrane repolarization during cardiac muscle cell action potential "," http://amigo.geneontology.org/amigo/term/GO:0086013"," KCND3  KCNE1"
0.0243263761505371,10,1580,3.06975491516294,"Reproduction "," http://amigo.geneontology.org/amigo/term/GO:0000003"," ARSA  CCND1  PKD2  CCNA1  CCNB3  THRB  CCNB2  HPGD  CCNE2  PRKDC"
0.0243263761505371,10,1577,3.07559465184366,"Reproductive process "," http://amigo.geneontology.org/amigo/term/GO:0022414"," ARSA  CCND1  PKD2  CCNA1  CCNB3  THRB  CCNB2  HPGD  CCNE2  PRKDC"
0.0243263761505371,2,25,38.8017021276596,"Regulation of cardiac muscle cell membrane repolarization "," http://amigo.geneontology.org/amigo/term/GO:0099623"," KCNE1  SCN5A"
0.0252108268394535,11,1885,2.83036288729612,"Cell-cell signaling "," http://amigo.geneontology.org/amigo/term/GO:0007267"," TNKS2  PMP22  CCND1  GLP1R  GLS  PKD2  PIN1  CA7  CDK5R1  SCN5A  CACNA1C"
0.0252108268394535,3,104,13.9909983633388,"Regulation of calcium ion transport into cytosol "," http://amigo.geneontology.org/amigo/term/GO:0010522"," PKD2  HTT  CACNA1C"
0.0252108268394535,4,231,8.39863682416874,"Potassium ion transmembrane transport "," http://amigo.geneontology.org/amigo/term/GO:0071805"," PKD2  KCND3  KCNE1  KCNQ1"
0.0252108268394535,2,26,37.3093289689034,"Membrane repolarization during action potential "," http://amigo.geneontology.org/amigo/term/GO:0086011"," KCND3  KCNE1"
0.0255762287327887,5,399,6.0779608595958,"Regulation of cation transmembrane transport "," http://amigo.geneontology.org/amigo/term/GO:1904062"," PKD2  KCNE1  SCN5A  HTT  CACNA1C"
0.0257352823006862,3,106,13.7270172621437,"Muscle adaptation "," http://amigo.geneontology.org/amigo/term/GO:0043500"," PIN1  PARP1  SCN5A"
0.0257671353861934,9,1329,3.284568464531,"Response to abiotic stimulus "," http://amigo.geneontology.org/amigo/term/GO:0009628"," ARSA  CA9  CCND1  PKD2  PIN1  PARP1  PDK1  HTT  PRKDC"
0.0260136422101396,4,236,8.22069960331771,"Regulation of muscle system process "," http://amigo.geneontology.org/amigo/term/GO:0090257"," PIN1  PARP1  SCN5A  CACNA1C"
0.0275079068890637,2,28,34.644376899696,"Positive regulation of cardiac muscle hypertrophy "," http://amigo.geneontology.org/amigo/term/GO:0010613"," PIN1  PARP1"
0.0275079068890637,3,110,13.2278529980658,"Positive regulation of neuron death "," http://amigo.geneontology.org/amigo/term/GO:1901216"," PIN1  PARP1  CDK5R1"
0.028607844350672,7,843,4.02746018525529,"Inorganic cation transmembrane transport "," http://amigo.geneontology.org/amigo/term/GO:0098662"," PKD2  KCND3  KCNE1  SCN5A  HTT  KCNQ1  CACNA1C"
0.0289338307012169,2,29,33.4497432134996,"Positive regulation of muscle hypertrophy "," http://amigo.geneontology.org/amigo/term/GO:0014742"," PIN1  PARP1"
0.0306621870551348,2,30,32.3347517730496,"Negative regulation of telomere maintenance via telomere lengthening "," http://amigo.geneontology.org/amigo/term/GO:1904357"," TNKS2  PARP1"
0.0313359306796623,6,632,4.60463237274441,"Circulatory system process "," http://amigo.geneontology.org/amigo/term/GO:0003013"," GLP1R  THRB  KCND3  KCNE1  SCN5A  CACNA1C"
0.0313359306796623,4,253,7.66832057858885,"Neuron apoptotic process "," http://amigo.geneontology.org/amigo/term/GO:0051402"," PIN1  PARP1  THRB  CDK5R1"
0.0319464643780955,4,255,7.60817688777639,"Potassium ion transport "," http://amigo.geneontology.org/amigo/term/GO:0006813"," PKD2  KCND3  KCNE1  KCNQ1"
0.0356983455600573,2,33,29.3952288845906,"Cell-cell signaling involved in cardiac conduction "," http://amigo.geneontology.org/amigo/term/GO:0086019"," SCN5A  CACNA1C"
0.0365395013737098,5,448,5.41318389057751,"Regulation of metal ion transport "," http://amigo.geneontology.org/amigo/term/GO:0010959"," PKD2  KCNE1  SCN5A  HTT  CACNA1C"
0.0365395013737098,3,126,11.548125633232,"Release of sequestered calcium ion into cytosol "," http://amigo.geneontology.org/amigo/term/GO:0051209"," PKD2  HTT  CACNA1C"
0.0365395013737098,2,34,28.5306633291615,"Regulation of membrane repolarization "," http://amigo.geneontology.org/amigo/term/GO:0060306"," KCNE1  SCN5A"
0.0365395013737098,2,34,28.5306633291615,"Regulation of cardiac muscle cell contraction "," http://amigo.geneontology.org/amigo/term/GO:0086004"," SCN5A  CACNA1C"
0.0368072143108435,5,451,5.37717601547389,"Regulation of membrane potential "," http://amigo.geneontology.org/amigo/term/GO:0042391"," PARP1  KCND3  KCNE1  SCN5A  CACNA1C"
0.0368072143108435,3,127,11.4571955101357,"Negative regulation of sequestering of calcium ion "," http://amigo.geneontology.org/amigo/term/GO:0051283"," PKD2  HTT  CACNA1C"
0.037680608241969,2,35,27.7155015197568,"Long-chain fatty acid biosynthetic process "," http://amigo.geneontology.org/amigo/term/GO:0042759"," EPHX2  HPGD"
0.0377182206239792,3,129,11.2795645719941,"Regulation of sequestering of calcium ion "," http://amigo.geneontology.org/amigo/term/GO:0051282"," PKD2  HTT  CACNA1C"
0.0381846334641283,4,276,7.02929386370644,"Meiotic cell cycle "," http://amigo.geneontology.org/amigo/term/GO:0051321"," CCNA1  CCNB3  CCNB2  CCNE2"
0.0381846334641283,2,36,26.9456264775414,"Response to mineralocorticoid "," http://amigo.geneontology.org/amigo/term/GO:0051385"," CCND1  PARP1"
0.0381846334641283,2,36,26.9456264775414,"Membrane depolarization during action potential "," http://amigo.geneontology.org/amigo/term/GO:0086010"," SCN5A  CACNA1C"
0.0381846334641283,7,909,3.73503733352059,"Inorganic ion transmembrane transport "," http://amigo.geneontology.org/amigo/term/GO:0098660"," PKD2  KCND3  KCNE1  SCN5A  HTT  KCNQ1  CACNA1C"
0.0394294810750433,3,133,10.9403295472724,"Sequestering of calcium ion "," http://amigo.geneontology.org/amigo/term/GO:0051208"," PKD2  HTT  CACNA1C"
0.0410426483104407,2,38,25.5274356103024,"Nucleotide-excision repair, preincision complex assembly "," http://amigo.geneontology.org/amigo/term/GO:0006294"," CCNH  PARP1"
0.0410426483104407,2,38,25.5274356103024,"Protein ADP-ribosylation "," http://amigo.geneontology.org/amigo/term/GO:0006471"," TNKS2  PARP1"
0.0410426483104407,10,1769,2.74178223061472,"Response to endogenous stimulus "," http://amigo.geneontology.org/amigo/term/GO:0009719"," ARSA  CCND1  GLP1R  PKD2  PIN1  PARP1  THRB  HPGD  KCNE1  PRKDC"
0.0410426483104407,2,38,25.5274356103024,"Negative regulation of telomere maintenance "," http://amigo.geneontology.org/amigo/term/GO:0032205"," TNKS2  PARP1"
0.0419401184032864,2,39,24.872885979269,"Anion homeostasis "," http://amigo.geneontology.org/amigo/term/GO:0055081"," CA12  GLS"
0.0419401184032864,2,39,24.872885979269,"Regulation of protein targeting to membrane "," http://amigo.geneontology.org/amigo/term/GO:0090313"," CDK5R1  KCNE1"
0.0419401184032864,2,39,24.872885979269,"Regulation of actin filament-based movement "," http://amigo.geneontology.org/amigo/term/GO:1903115"," SCN5A  CACNA1C"
0.0434113723170883,3,141,10.3196016296967,"Meiosis I "," http://amigo.geneontology.org/amigo/term/GO:0007127"," CCNA1  CCNB2  CCNE2"
0.0434113723170883,2,40,24.2510638297872,"Positive regulation of calcium ion transmembrane transporter activity "," http://amigo.geneontology.org/amigo/term/GO:1901021"," PKD2  HTT"
0.0448872617785757,6,710,4.09877135151334,"Positive regulation of cell death "," http://amigo.geneontology.org/amigo/term/GO:0010942"," PIN1  PARP1  HPGD  CDK5R1  HTT  PRKDC"
0.0448872617785757,2,41,23.6595744680851,"Positive regulation of double-strand break repair "," http://amigo.geneontology.org/amigo/term/GO:2000781"," PARP1  PRKDC"
0.045352035182176,2,42,23.096251266464,"Regulation of membrane depolarization "," http://amigo.geneontology.org/amigo/term/GO:0003254"," PARP1  SCN5A"
0.045352035182176,2,42,23.096251266464,"Positive regulation of release of sequestered calcium ion into cytosol "," http://amigo.geneontology.org/amigo/term/GO:0051281"," PKD2  HTT"
0.045352035182176,3,146,9.96619061498105,"Meiosis I cell cycle process "," http://amigo.geneontology.org/amigo/term/GO:0061982"," CCNA1  CCNB2  CCNE2"
0.045352035182176,2,42,23.096251266464,"Regulation of purine nucleotide biosynthetic process "," http://amigo.geneontology.org/amigo/term/GO:1900371"," PARP1  PDK1"
0.045352035182176,8,1231,3.15204728900565,"Response to nitrogen compound "," http://amigo.geneontology.org/amigo/term/GO:1901698"," PIK3C3  CCND1  GLP1R  PKD2  PARP1  CDK5R1  KCNE1  PRKDC"
0.0471578440525678,2,43,22.5591291439881,"Regulation of nucleotide biosynthetic process "," http://amigo.geneontology.org/amigo/term/GO:0030808"," PARP1  PDK1"
0.0472804959259742,3,149,9.76552905897472,"Calcium ion transmembrane import into cytosol "," http://amigo.geneontology.org/amigo/term/GO:0097553"," PKD2  HTT  CACNA1C"
0.0486339492408849,2,44,22.0464216634429,"Intrinsic apoptotic signaling pathway in response to oxidative stress "," http://amigo.geneontology.org/amigo/term/GO:0008631"," PARP1  PDK1"
0.0492137500225621,7,984,3.45035460992908,"Metal ion transport "," http://amigo.geneontology.org/amigo/term/GO:0030001"," PKD2  KCND3  KCNE1  SCN5A  HTT  KCNQ1  CACNA1C"
0.0492137500225621,7,986,3.44335591903673,"Cation transmembrane transport "," http://amigo.geneontology.org/amigo/term/GO:0098655"," PKD2  KCND3  KCNE1  SCN5A  HTT  KCNQ1  CACNA1C"
0.0492137500225621,9,1545,2.82536665978104,"Export from cell "," http://amigo.geneontology.org/amigo/term/GO:0140352"," PIK3C3  ARSA  GLP1R  RAB9A  PDXK  KCND3  KCNE1  TUBB  CACNA1C"
0.0500620767009236,3,154,9.44846642718983,"Response to ionizing radiation "," http://amigo.geneontology.org/amigo/term/GO:0010212"," CCND1  PARP1  PRKDC"
0.0506253935670326,3,155,9.38750857927248,"Response to calcium ion "," http://amigo.geneontology.org/amigo/term/GO:0051592"," CCND1  PKD2  SCN5A"
0.0517696228424378,4,318,6.10089656095276,"Positive regulation of ion transport "," http://amigo.geneontology.org/amigo/term/GO:0043270"," PKD2  KCNE1  SCN5A  HTT"
0.0527204044452365,2,47,20.6392032593934,"Negative regulation of cation channel activity "," http://amigo.geneontology.org/amigo/term/GO:2001258"," PKD2  KCNE1"
